{
  "name": "ohmyclaude",
  "version": "2.3.1",
  "description": "10-agent OSS pipeline for Claude Code — Agent Teams coordination, single /forge entry point, Java-first skills, source graph integration.",
  "author": {
    "name": "ohmyclaude contributors"
  },
  "license": "MIT",
  "keywords": [
    "claude-code",
    "agents",
    "multi-agent",
    "orchestration",
    "skills",
    "hooks",
    "lsp",
    "quality",
    "automation"
  ],
  "agents": [
    "./agents/paige-product.md",
    "./agents/artie-arch.md",
    "./agents/una-ux.md",
    "./agents/sam-sec.md",
    "./agents/beck-backend.md",
    "./agents/effie-frontend.md",
    "./agents/quinn-qa.md",
    "./agents/stan-standards.md",
    "./agents/devon-ops.md",
    "./agents/heracles.md"
  ],
  "skills": [
    "./skills/"
  ],
  "commands": [
    "./commands/"
  ]
}
